1085,7859,MISSION IMPOSSIBLE: Official story of Las Vegas shooting unravels; physical impossibility of lone gunman senior citizen makes narrative ludicrous,2017-12-07 11:16:50 UTC,"It's all hogwash. The ""official"" narrative of how things went down in the Las Vegas massacre is so full of holes that it begs the question of just how deep the truth about this [...]",https://www.naturalnews.com/2017-10-02-lone-gunman-theory-of-las-vegas-shooter-is-complete-nonsense-stephen-paddock.html,complete,22033,1666218,2017-10-02 19:37:56 +0000,page,2,,51,0,24,24,Rate your impression of the credibility of this article.,Check-2018-01,2017-12-26 17:44:45 UTC,Somewhat high credibility,,Has the text of this article appeared in exactly the same words or very similar words in another publication?,Check-2018-01,2017-12-26 17:51:57 UTC,A) Most likely original,,"If you answered B, C, D, above, was attribution given and if so, was the attribution accurate?",Check-2018-01,2017-12-26 18:04:47 UTC,D) Unclear which is the original,,Has the central claim in this article been fact-checked by another source?,Check-2018-01,2017-12-26 17:52:21 UTC,B) Most likely not fact-checked by an approved source,,Is Source 1...,Check-2018-01,2017-12-26 17:52:58 UTC,An organization,NY Daily News,Is a link for Source 1 provided in the article to where the original content came from?,Check-2018-01,2017-12-26 17:58:33 UTC,Yes,,"If you can find it, paste the impact factor of the journal or conference of Source 1.",Check-2018-01,2017-12-26 17:58:43 UTC,NY Daily News,,This article properly characterizes the methods and conclusions of the cited or quoted source (Source 1).,Check-2018-01,2017-12-26 17:58:48 UTC,Strongly disagree,,Is Source 2...,Check-2018-01,2017-12-26 17:59:56 UTC,An organization,NY Daily News,Is a link for Source 2 provided in the article to where the original content came from?,Check-2018-01,2017-12-26 18:00:08 UTC,No,,"If you can find it, paste the impact factor of the journal or conference of Source 2.",Check-2018-01,2017-12-26 18:00:17 UTC,NY Daily News,,This article properly characterizes the methods and conclusions of the cited or quoted source (Source 2).,Check-2018-01,2017-12-26 18:00:37 UTC,Somewhat agree,,Is Source 3...,Check-2018-01,2017-12-26 18:01:07 UTC,An organization,,Is a link for Source 3 provided in the article to where the original content came from?,Check-2018-01,2017-12-26 18:01:15 UTC,Yes,https://www.naturalnews.com/036536_James_Holmes_shooting_false_flag.html,"If you can find it, paste the impact factor of the journal or conference of Source 3.",Check-2018-01,2017-12-26 18:01:41 UTC,NY Daily News,,This article properly characterizes the methods and conclusions of the cited or quoted source (Source 3).,Check-2018-01,2017-12-26 18:01:52 UTC,Strongly agree,,Number of display ads,Check-2018-01,2017-12-26 18:06:52 UTC,18,,Number of content recommendation boxes,Check-2018-01,2017-12-26 18:06:58 UTC,8,,Number of links to sponsored content,Check-2018-01,2017-12-26 17:55:24 UTC,10,,Number of calls to social shares,Check-2018-01,2017-12-26 17:54:31 UTC,8,,Number of calls to join a mailing list,Check-2018-01,2017-12-26 17:53:42 UTC,2,,The page of the article has spammy or clickbaity advertisements.,Check-2018-01,2017-12-26 17:56:06 UTC,Somewhat agree,,"The page of the article has aggressively-placed advertisements, social shares and calls to join a mailing list.",Check-2018-01,2017-12-26 17:56:09 UTC,Strongly agree,,"After having finished the above, please rate your impression of the credibility of this article. if your impression hasn't changed, select ""no change.""",Check-2018-01,2017-12-26 17:56:16 UTC,Medium credibility,,,,,,,,,
1085,7861,Health Experts Are Warning People To Stop Eating Tilapia,2017-12-07 11:18:10 UTC,"Eating seafood is a great way to get vital nutrients and vitamins. Tilapia is the most popular farmed fish in America because of its affordability. But health experts are warning consumers to stay as far away as possible from Tilapia. Flip over to the next page to see why… CONTINUE READING HERE Tilapia Contains Few Nutrients: Researchers from the Wake Forest University School of Medicine released a report on the omega-3 fatty acid content in popular fish. Tilapia scored far lower than most other fish on the list. Omega-3 fatty acids give fish most of their benefits, including Alzheimer's risk reduction. Tilapia contains a TON of omega-6 fatty acids, which are terrible for you. The quantity of omega-6 in tilapia is higher than a hamburger or bacon. Flip over to the next page to see another reason why Tilapia can kill you… CONTINUE READING HERE Tilapia Could Cause Alzheimer's: One of the omega-6 fatty acids in tilapia goes by the name of arachidonic acid – a compound which",https://www.androidmagazines.info/health-experts-are-warning-people-to-stop-eating-tilapia/,complete,21953,1663155,,page,2,,43,0,24,16,Rate your impression of the credibility of this article.,Check-2018-01,2017-12-26 17:05:15 UTC,Somewhat low credibility,,Has the text of this article appeared in exactly the same words or very similar words in another publication?,Check-2018-01,2017-12-26 17:06:53 UTC,"C) Extensive quoting from another source, with some original content",,"If you answered B, C, D, above, was attribution given and if so, was the attribution accurate?",Check-2018-01,2017-12-26 17:08:39 UTC,C) Attribution was given and was accurate,,Has the central claim in this article been fact-checked by another source?,Check-2018-01,2017-12-26 17:09:07 UTC,B) Most likely not fact-checked by an approved source,Highly sensationalized,Is Source 1...,Check-2018-01,2017-12-26 17:09:54 UTC,A scientific study,,Is a link for Source 1 provided in the article to where the original content came from?,Check-2018-01,2017-12-26 17:10:09 UTC,No,,"If you can find it, paste the impact factor of the journal or conference of Source 1.",Check-2018-01,2017-12-26 17:10:24 UTC,https://www.wakehealth.edu/,,This article properly characterizes the methods and conclusions of the cited or quoted source (Source 1).,Check-2018-01,2017-12-26 17:10:31 UTC,Somewhat disagree,"Sensationalized, eg nowhere in study does it say eating tilapia will ""kill"" you, as it does in the Android article",Is Source 2...,,,,,Is a link for Source 2 provided in the article to where the original content came from?,,,,,"If you can find it, paste the impact factor of the journal or conference of Source 2.",,,,,This article properly characterizes the methods and conclusions of the cited or quoted source (Source 2).,,,,,Is Source 3...,,,,,Is a link for Source 3 provided in the article to where the original content came from?,,,,,"If you can find it, paste the impact factor of the journal or conference of Source 3.",,,,,This article properly characterizes the methods and conclusions of the cited or quoted source (Source 3).,,,,,Number of display ads,Check-2018-01,2017-12-26 17:15:08 UTC,5,,Number of content recommendation boxes,Check-2018-01,2017-12-26 17:16:38 UTC,0,,Number of links to sponsored content,Check-2018-01,2017-12-26 17:14:39 UTC,1,,Number of calls to social shares,Check-2018-01,2017-12-26 17:04:23 UTC,11,,Number of calls to join a mailing list,Check-2018-01,2017-12-26 17:13:50 UTC,0,,The page of the article has spammy or clickbaity advertisements.,Check-2018-01,2017-12-26 17:13:05 UTC,Somewhat agree,,"The page of the article has aggressively-placed advertisements, social shares and calls to join a mailing list.",Check-2018-01,2017-12-26 17:13:00 UTC,Somewhat agree,,"After having finished the above, please rate your impression of the credibility of this article. if your impression hasn't changed, select ""no change.""",Check-2018-01,2017-12-26 17:12:54 UTC,Medium credibility,,,,,,,,,
1085,7863,Stop holding your farts in. Here are 7 unexpected health benefits of passing gas,2017-12-07 11:18:59 UTC,"We're often self-conscious when we fart. However, farting is actually healthy for you. Here's why!",https://shareably.net/health-benefits-farting/,complete,21903,1664714,,page,2,,46,0,24,19,Rate your impression of the credibility of this article.,Check-2018-01,2017-12-26 17:37:59 UTC,Somewhat low credibility,,Has the text of this article appeared in exactly the same words or very similar words in another publication?,Check-2018-01,2017-12-26 17:38:31 UTC,A) Most likely original,,"If you answered B, C, D, above, was attribution given and if so, was the attribution accurate?",,,,,Has the central claim in this article been fact-checked by another source?,Check-2018-01,2017-12-26 17:38:37 UTC,B) Most likely not fact-checked by an approved source,,Is Source 1...,Check-2018-01,2017-12-26 17:40:36 UTC,thefartsfact.com,,Is a link for Source 1 provided in the article to where the original content came from?,Check-2018-01,2017-12-26 17:40:48 UTC,Yes,"Link provided -- but it doesn't work.
","If you can find it, paste the impact factor of the journal or conference of Source 1.",Check-2018-01,2017-12-26 17:40:53 UTC,thefartsfact.com,,This article properly characterizes the methods and conclusions of the cited or quoted source (Source 1).,Check-2018-01,2017-12-26 17:41:45 UTC,Unable to find source,,Is Source 2...,Check-2018-01,2017-12-26 17:41:59 UTC,An organization,,Is a link for Source 2 provided in the article to where the original content came from?,Check-2018-01,2017-12-26 17:42:20 UTC,Yes,http://www.medicaldaily.com/farting-good-health-benefits-flatulence-381176,"If you can find it, paste the impact factor of the journal or conference of Source 2.",Check-2018-01,2017-12-26 17:42:29 UTC,medicaldaily.com,,This article properly characterizes the methods and conclusions of the cited or quoted source (Source 2).,Check-2018-01,2017-12-26 17:42:46 UTC,Somewhat agree,,Is Source 3...,,,,,Is a link for Source 3 provided in the article to where the original content came from?,,,,,"If you can find it, paste the impact factor of the journal or conference of Source 3.",,,,,This article properly characterizes the methods and conclusions of the cited or quoted source (Source 3).,,,,,Number of display ads,Check-2018-01,2017-12-24 17:52:07 UTC,3,,Number of content recommendation boxes,Check-2018-01,2017-12-26 17:43:49 UTC,0,,Number of links to sponsored content,Check-2018-01,2017-12-26 17:43:53 UTC,0,,Number of calls to social shares,Check-2018-01,2017-12-24 17:50:51 UTC,1,,Number of calls to join a mailing list,Check-2018-01,2017-12-24 17:50:27 UTC,1,,The page of the article has spammy or clickbaity advertisements.,Check-2018-01,2017-12-26 17:37:31 UTC,Somewhat disagree,,"The page of the article has aggressively-placed advertisements, social shares and calls to join a mailing list.",Check-2018-01,2017-12-26 17:37:36 UTC,Somewhat agree,,"After having finished the above, please rate your impression of the credibility of this article. if your impression hasn't changed, select ""no change.""",Check-2018-01,2017-12-26 17:37:49 UTC,Very low credibility,,,,,,,,,
1085,7865,Tesla made more money last quarter than the entire US oil industry made last year,2017-12-07 11:19:41 UTC,"While there are nuances to the claim made in this headline, it is technically true since Tesla announced that it turned a profit of $22 million last quarter while the US oil industry managed to los…",https://electrek.co/2016/11/10/tesla-made-more-money-last-quarter-than-the-entire-us-oil-industry-made-last-year,complete,21861,1673535,2016-11-10 10:28:42 +0000,page,2,,50,0,24,23,Rate your impression of the credibility of this article.,Check-2018-01,2017-12-24 17:47:27 UTC,Medium credibility,,Has the text of this article appeared in exactly the same words or very similar words in another publication?,Check-2018-01,2017-12-26 20:07:02 UTC,A) Most likely original,,"If you answered B, C, D, above, was attribution given and if so, was the attribution accurate?",,,,,Has the central claim in this article been fact-checked by another source?,Check-2018-01,2017-12-26 20:07:21 UTC,B) Most likely not fact-checked by an approved source,,Is Source 1...,Check-2018-01,2017-12-26 20:09:24 UTC,An organization,Reuters,Is a link for Source 1 provided in the article to where the original content came from?,Check-2018-01,2017-12-26 20:09:27 UTC,Yes,,"If you can find it, paste the impact factor of the journal or conference of Source 1.",Check-2018-01,2017-12-26 20:10:08 UTC,https://www.reuters.com/,,This article properly characterizes the methods and conclusions of the cited or quoted source (Source 1).,Check-2018-01,2017-12-26 20:10:18 UTC,Somewhat agree,,Is Source 2...,Check-2018-01,2017-12-26 20:10:32 UTC,An organization,,Is a link for Source 2 provided in the article to where the original content came from?,Check-2018-01,2017-12-26 20:10:36 UTC,Yes,https://www.imf.org/en/News/Articles/2015/09/28/04/53/sonew070215a,"If you can find it, paste the impact factor of the journal or conference of Source 2.",Check-2018-01,2017-12-26 20:10:46 UTC,https://www.imf.org/,,This article properly characterizes the methods and conclusions of the cited or quoted source (Source 2).,Check-2018-01,2017-12-26 20:10:56 UTC,Somewhat agree,,Is Source 3...,Check-2018-01,2017-12-26 20:11:24 UTC,An organization,http://media.gm.com/media/us/en/gm/home.detail.html/content/Pages/news/us/en/2016/nov/1109-production.html,Is a link for Source 3 provided in the article to where the original content came from?,Check-2018-01,2017-12-26 20:11:28 UTC,Yes,http://media.gm.com/media/us/en/gm/home.detail.html/content/Pages/news/us/en/2016/nov/1109-production.html,"If you can find it, paste the impact factor of the journal or conference of Source 3.",Check-2018-01,2017-12-26 20:11:38 UTC,http://media.gm.com/,,This article properly characterizes the methods and conclusions of the cited or quoted source (Source 3).,Check-2018-01,2017-12-26 20:11:47 UTC,Strongly agree,,Number of display ads,Check-2018-01,2017-12-24 17:48:47 UTC,1,,Number of content recommendation boxes,Check-2018-01,2017-12-24 17:48:42 UTC,0,,Number of links to sponsored content,Check-2018-01,2017-12-24 17:48:18 UTC,0,,Number of calls to social shares,Check-2018-01,2017-12-24 17:47:32 UTC,13,,Number of calls to join a mailing list,Check-2018-01,2017-12-24 17:48:02 UTC,0,,The page of the article has spammy or clickbaity advertisements.,Check-2018-01,2017-12-24 17:49:04 UTC,Strongly disagree,,"The page of the article has aggressively-placed advertisements, social shares and calls to join a mailing list.",Check-2018-01,2017-12-26 20:08:50 UTC,Somewhat disagree,,"After having finished the above, please rate your impression of the credibility of this article. if your impression hasn't changed, select ""no change.""",Check-2018-01,2017-12-26 20:11:52 UTC,Somewhat high credibility,,,,,,,,,
1085,7869,Putting Kids To Bed Early Improves Mom's Health - Simplemost,2017-12-07 11:25:44 UTC,"A new study confirms why all those bedtime battles are indeed worth it. When kids go to bed early, they are healthier and mom is happier.",https://www.simplemost.com/new-study-says-putting-kids-to-bed-earlier-is-better-for-moms-sanity/,complete,21499,1669595,2017-05-02 15:35:08 +0000,page,2,,47,0,24,20,Rate your impression of the credibility of this article.,Check-2018-01,2017-12-24 17:38:55 UTC,Medium credibility,,Has the text of this article appeared in exactly the same words or very similar words in another publication?,Check-2018-01,2017-12-26 19:08:34 UTC,A) Most likely original,,"If you answered B, C, D, above, was attribution given and if so, was the attribution accurate?",,,,,Has the central claim in this article been fact-checked by another source?,,,,,Is Source 1...,Check-2018-01,2017-12-26 19:09:22 UTC,An organization,https://www.simplemost.com/potty-training-absolute-worst/?utm_campaign=simplemost_referral&utm_source=website&utm_medium=article&utm_partner=simplemost,Is a link for Source 1 provided in the article to where the original content came from?,Check-2018-01,2017-12-26 19:09:21 UTC,Yes,https://www.simplemost.com/potty-training-absolute-worst/?utm_campaign=simplemost_referral&utm_source=website&utm_medium=article&utm_partner=simplemost,"If you can find it, paste the impact factor of the journal or conference of Source 1.",Check-2018-01,2017-12-26 19:09:33 UTC,https://www.simplemost.com,,This article properly characterizes the methods and conclusions of the cited or quoted source (Source 1).,Check-2018-01,2017-12-26 19:10:03 UTC,Somewhat agree,,Is Source 2...,Check-2018-01,2017-12-26 19:10:09 UTC,An organization,https://www.parents.com/baby/new-parent/sleep-deprivation/how-to-get-sleep/,Is a link for Source 2 provided in the article to where the original content came from?,Check-2018-01,2017-12-26 19:10:49 UTC,Yes,,"If you can find it, paste the impact factor of the journal or conference of Source 2.",Check-2018-01,2017-12-26 19:11:15 UTC,https://www.parents.com/baby,,This article properly characterizes the methods and conclusions of the cited or quoted source (Source 2).,Check-2018-01,2017-12-26 19:11:19 UTC,Strongly agree,,Is Source 3...,Check-2018-01,2017-12-26 19:11:45 UTC,An organization,,Is a link for Source 3 provided in the article to where the original content came from?,Check-2018-01,2017-12-26 19:11:57 UTC,Yes,https://www.parents.com/baby/development/walking/,"If you can find it, paste the impact factor of the journal or conference of Source 3.",Check-2018-01,2017-12-26 19:12:07 UTC,https://www.parents.com,,This article properly characterizes the methods and conclusions of the cited or quoted source (Source 3).,Check-2018-01,2017-12-26 19:12:13 UTC,Strongly agree,,Number of display ads,Check-2018-01,2017-12-24 17:39:58 UTC,2,,Number of content recommendation boxes,Check-2018-01,2017-12-24 17:41:13 UTC,21,,Number of links to sponsored content,Check-2018-01,2017-12-24 17:40:22 UTC,6,,Number of calls to social shares,Check-2018-01,2017-12-24 17:39:00 UTC,8,,Number of calls to join a mailing list,Check-2018-01,2017-12-24 17:39:15 UTC,1,,The page of the article has spammy or clickbaity advertisements.,,,,,"The page of the article has aggressively-placed advertisements, social shares and calls to join a mailing list.",,,,,"After having finished the above, please rate your impression of the credibility of this article. if your impression hasn't changed, select ""no change.""",Check-2018-01,2017-12-26 19:07:07 UTC,Somewhat high credibility,,,,,,,,,
1085,7871,If Everyone Ate Beans Instead of Beef,2017-12-07 11:26:38 UTC,"With one dietary change, the U.S. could hypothetically get 74 percent of the way to meeting 2020 greenhouse-gas emission goals.",https://www.theatlantic.com/health/archive/2017/08/if-everyone-ate-beans-instead-of-beef/535536/,complete,21445,1668662,,page,2,,50,0,24,23,Rate your impression of the credibility of this article.,Check-2018-01,2017-12-24 17:33:40 UTC,Somewhat high credibility,,Has the text of this article appeared in exactly the same words or very similar words in another publication?,Check-2018-01,2017-12-26 18:46:01 UTC,A) Most likely original,,"If you answered B, C, D, above, was attribution given and if so, was the attribution accurate?",,,,,Has the central claim in this article been fact-checked by another source?,Check-2018-01,2017-12-26 18:54:24 UTC,B) Most likely not fact-checked by an approved source,,Is Source 1...,Check-2018-01,2017-12-26 18:54:48 UTC,An organization,American Psychological Association,Is a link for Source 1 provided in the article to where the original content came from?,Check-2018-01,2017-12-26 18:55:14 UTC,Yes,http://www.apa.org/news/press/releases/2017/03/mental-health-climate.pdf,"If you can find it, paste the impact factor of the journal or conference of Source 1.",Check-2018-01,2017-12-26 18:55:23 UTC,http://www.apa.org/,,This article properly characterizes the methods and conclusions of the cited or quoted source (Source 1).,Check-2018-01,2017-12-26 18:55:30 UTC,Strongly agree,,Is Source 2...,Check-2018-01,2017-12-26 18:55:51 UTC,An organization,Politifact,Is a link for Source 2 provided in the article to where the original content came from?,Check-2018-01,2017-12-26 18:55:55 UTC,Yes,http://www.politifact.com/truth-o-meter/statements/2016/jun/03/hillary-clinton/yes-donald-trump-did-call-climate-change-chinese-h/,"If you can find it, paste the impact factor of the journal or conference of Source 2.",Check-2018-01,2017-12-26 18:56:06 UTC,http://www.politifact.com/,,This article properly characterizes the methods and conclusions of the cited or quoted source (Source 2).,Check-2018-01,2017-12-26 18:56:12 UTC,Strongly agree,,Is Source 3...,Check-2018-01,2017-12-26 18:56:50 UTC,An organization,https://www.theguardian.com/environment/2016/dec/15/trump-cabinet-climate-change-deniers,Is a link for Source 3 provided in the article to where the original content came from?,Check-2018-01,2017-12-26 18:56:41 UTC,Yes,https://www.theguardian.com/environment/2016/dec/15/trump-cabinet-climate-change-deniers,"If you can find it, paste the impact factor of the journal or conference of Source 3.",Check-2018-01,2017-12-26 18:56:31 UTC,https://www.theguardian.com,,This article properly characterizes the methods and conclusions of the cited or quoted source (Source 3).,Check-2018-01,2017-12-26 18:57:06 UTC,Strongly agree,,Number of display ads,Check-2018-01,2017-12-24 17:37:26 UTC,4,,Number of content recommendation boxes,Check-2018-01,2017-12-24 17:36:55 UTC,4,,Number of links to sponsored content,Check-2018-01,2017-12-24 17:36:06 UTC,1,,Number of calls to social shares,Check-2018-01,2017-12-24 17:34:40 UTC,17,,Number of calls to join a mailing list,Check-2018-01,2017-12-24 17:35:04 UTC,4,,The page of the article has spammy or clickbaity advertisements.,Check-2018-01,2017-12-26 18:57:15 UTC,Somewhat disagree,,"The page of the article has aggressively-placed advertisements, social shares and calls to join a mailing list.",Check-2018-01,2017-12-26 18:57:19 UTC,Somewhat agree,,"After having finished the above, please rate your impression of the credibility of this article. if your impression hasn't changed, select ""no change.""",Check-2018-01,2017-12-26 18:57:23 UTC,Very high credibility,,,,,,,,,
1085,7872,WITH ONLY 2 CUPS A DAY FOR 1 WEEK YOUR STOMACH WILL BE FLATTER! - Public Health ABC,2017-12-07 11:29:01 UTC,"The desire of lots of people is to have a flat stomach. Sadly, you cannot just exercise your method to it. A lot involves exactly what you put into your mouth. Do you have excess fat in your abdomen location and want to get rid of it when and for all? Fortunately, today we will...",http://publichealthabc.com/2-cups-day-1-week-stomach-will-flatter/,complete,21303,1663062,2017-02-27 09:53:31 +0000,page,2,,38,0,24,11,Rate your impression of the credibility of this article.,Check-2018-01,2017-12-24 17:29:23 UTC,Very low credibility,,Has the text of this article appeared in exactly the same words or very similar words in another publication?,Check-2018-01,2017-12-26 17:21:48 UTC,A) Most likely original,,"If you answered B, C, D, above, was attribution given and if so, was the attribution accurate?",,,,,Has the central claim in this article been fact-checked by another source?,Check-2018-01,2017-12-26 17:23:55 UTC,B) Most likely not fact-checked by an approved source,,Is Source 1...,,,,,Is a link for Source 1 provided in the article to where the original content came from?,,,,,"If you can find it, paste the impact factor of the journal or conference of Source 1.",,,,,This article properly characterizes the methods and conclusions of the cited or quoted source (Source 1).,,,,,Is Source 2...,,,,,Is a link for Source 2 provided in the article to where the original content came from?,,,,,"If you can find it, paste the impact factor of the journal or conference of Source 2.",,,,,This article properly characterizes the methods and conclusions of the cited or quoted source (Source 2).,,,,,Is Source 3...,,,,,Is a link for Source 3 provided in the article to where the original content came from?,,,,,"If you can find it, paste the impact factor of the journal or conference of Source 3.",,,,,This article properly characterizes the methods and conclusions of the cited or quoted source (Source 3).,,,,,Number of display ads,Check-2018-01,2017-12-24 17:31:02 UTC,3,,Number of content recommendation boxes,Check-2018-01,2017-12-24 17:32:26 UTC,0,,Number of links to sponsored content,Check-2018-01,2017-12-24 17:31:54 UTC,0,,Number of calls to social shares,Check-2018-01,2017-12-24 17:30:04 UTC,21,,Number of calls to join a mailing list,Check-2018-01,2017-12-24 17:32:38 UTC,0,,The page of the article has spammy or clickbaity advertisements.,Check-2018-01,2017-12-24 17:32:56 UTC,Neutral,Hard to differentiate between advertisements and their own content.,"The page of the article has aggressively-placed advertisements, social shares and calls to join a mailing list.",Check-2018-01,2017-12-24 17:33:06 UTC,Strongly agree,,"After having finished the above, please rate your impression of the credibility of this article. if your impression hasn't changed, select ""no change.""",Check-2018-01,2017-12-24 17:33:11 UTC,No change,,,,,,,,,
