1085,7901,DELINGPOLE: Global Warming Study Cancelled Because of 'Unprecedented' Ice,2017-12-07 11:47:17 UTC,"A global warming research study in Canada has been cancelled because of ""unprecedented"" thick summer ice. They blamed it on 'climate change.'",http://www.breitbart.com/big-government/2017/06/13/delingpole-ship-of-fools-iii-global-warming-study-cancelled-because-of-unprecedented-ice/,complete,20158,6034981,2017-06-13 17:24:06 +0000,page,2,,51,0,24,24,Rate your impression of the credibility of this article.,Check-2018-02,2018-02-15 08:04:13 UTC,Medium credibility,,Has the text of this article appeared in exactly the same words or very similar words in another publication?,Check-2018-02,2018-02-15 08:04:16 UTC,"C) Extensive quoting from another source, with some original content",https://www.spectator.co.uk/2014/01/ship-of-fools-2/,"If you answered B, C, D, above, was attribution given and if so, was the attribution accurate?",Check-2018-02,2018-02-15 08:05:04 UTC,D) Unclear which is the original,,Has the central claim in this article been fact-checked by another source?,Check-2018-02,2018-02-15 08:05:07 UTC,B) Most likely not fact-checked by an approved source,,Is Source 1...,Check-2018-02,2018-02-15 08:05:29 UTC,An organization,,Is a link for Source 1 provided in the article to where the original content came from?,Check-2018-02,2018-02-15 08:05:34 UTC,Yes,https://www.winnipegfreepress.com/local/u-of-m-climate-change-study-postponed-due-to-climate-change-428030543.html,"If you can find it, paste the impact factor of the journal or conference of Source 1.",Check-2018-02,2018-02-15 08:05:59 UTC,could not locate,,This article properly characterizes the methods and conclusions of the cited or quoted source (Source 1).,Check-2018-02,2018-02-15 08:06:45 UTC,Strongly agree,,Is Source 2...,Check-2018-02,2018-02-15 08:07:00 UTC,An organization,,Is a link for Source 2 provided in the article to where the original content came from?,Check-2018-02,2018-02-15 08:07:08 UTC,Yes,https://www.vice.com/en_ca/article/7xpezd/arctic-climate-change-study-canceled-because-of-climate-change,"If you can find it, paste the impact factor of the journal or conference of Source 2.",Check-2018-02,2018-02-15 08:07:41 UTC,could not locate,,This article properly characterizes the methods and conclusions of the cited or quoted source (Source 2).,Check-2018-02,2018-02-15 08:07:50 UTC,Strongly agree,,Is Source 3...,Check-2018-02,2018-02-15 08:08:04 UTC,An organization,,Is a link for Source 3 provided in the article to where the original content came from?,Check-2018-02,2018-02-15 08:08:09 UTC,Yes,https://www.spectator.co.uk/2014/01/ship-of-fools-2/,"If you can find it, paste the impact factor of the journal or conference of Source 3.",Check-2018-02,2018-02-15 08:08:13 UTC,could not locate,,This article properly characterizes the methods and conclusions of the cited or quoted source (Source 3).,Check-2018-02,2018-02-15 08:09:13 UTC,Somewhat agree,,Number of display ads,Check-2018-02,2018-02-15 08:09:30 UTC,0,,Number of content recommendation boxes,Check-2018-02,2018-02-15 08:09:44 UTC,3,,Number of links to sponsored content,Check-2018-02,2018-02-15 08:09:48 UTC,0,,Number of calls to social shares,Check-2018-02,2018-02-15 08:10:02 UTC,0,,Number of calls to join a mailing list,Check-2018-02,2018-02-15 08:10:04 UTC,2,,The page of the article has spammy or clickbaity advertisements.,Check-2018-02,2018-02-15 08:10:07 UTC,Somewhat agree,,"The page of the article has aggressively-placed advertisements, social shares and calls to join a mailing list.",Check-2018-02,2018-02-15 08:10:10 UTC,Somewhat agree,,Rate your impression of the credibility of this article.,Check-2018-02,2018-02-15 08:10:13 UTC,Somewhat high credibility,,,,,,,,,
1085,7903,,2017-12-07 11:47:59 UTC,,https://www.ntd.tv/inspiring/parenting/sam-berns-boy-aging-disease-progeria-dies-17.html,complete,20110,6033972,,page,3,,51,1,24,24,Rate your impression of the credibility of this article.,Check-2018-02,2018-02-15 07:50:18 UTC,Medium credibility,,Has the text of this article appeared in exactly the same words or very similar words in another publication?,Check-2018-02,2018-02-15 07:50:36 UTC,"C) Extensive quoting from another source, with some original content",,"If you answered B, C, D, above, was attribution given and if so, was the attribution accurate?",Check-2018-02,2018-02-15 07:50:41 UTC,A) Attribution was not given,http://abcnews.go.com/Health/sam-berns-boy-aging-disease-progeria-dies-17/story?id=21499994,Has the central claim in this article been fact-checked by another source?,Check-2018-02,2018-02-15 07:50:55 UTC,A) No central claim,,Is Source 1...,Check-2018-02,2018-02-15 07:52:16 UTC,An organization,,Is a link for Source 1 provided in the article to where the original content came from?,Check-2018-02,2018-02-15 07:52:22 UTC,Yes,http://abcnews.go.com/WNT/video/triumphant-story-sam-berns-progeria-math-20640669,"If you can find it, paste the impact factor of the journal or conference of Source 1.",Check-2018-02,2018-02-15 07:52:30 UTC,could not locate,,This article properly characterizes the methods and conclusions of the cited or quoted source (Source 1).,Check-2018-02,2018-02-15 07:52:33 UTC,Strongly agree,,Is Source 2...,Check-2018-02,2018-02-15 07:51:41 UTC,An organization,,Is a link for Source 2 provided in the article to where the original content came from?,Check-2018-02,2018-02-15 07:52:01 UTC,Yes,http://www.hbo.com/html/error/browser_message_a.html?return=http://www.hbo.com/documentaries/life-according-to-sam,"If you can find it, paste the impact factor of the journal or conference of Source 2.",Check-2018-02,2018-02-15 07:51:59 UTC,could not locate,,This article properly characterizes the methods and conclusions of the cited or quoted source (Source 2).,Check-2018-02,2018-02-15 07:52:03 UTC,Source is behind a paywall,,Is Source 3...,Check-2018-02,2018-02-15 07:52:49 UTC,An organization,,Is a link for Source 3 provided in the article to where the original content came from?,Check-2018-02,2018-02-15 07:52:52 UTC,Yes,https://www.youtube.com/watch?v=36m1o-tM05g,"If you can find it, paste the impact factor of the journal or conference of Source 3.",Check-2018-02,2018-02-15 07:52:55 UTC,could not locate,,This article properly characterizes the methods and conclusions of the cited or quoted source (Source 3).,Check-2018-02,2018-02-15 07:53:05 UTC,Source is behind a paywall,video no longer available,Number of display ads,Check-2018-02,2018-02-15 07:53:41 UTC,0,,Number of content recommendation boxes,Check-2018-02,2018-02-15 07:53:44 UTC,7,,Number of links to sponsored content,Check-2018-02,2018-02-15 07:53:47 UTC,0,,Number of calls to social shares,Check-2018-02,2018-02-15 07:53:48 UTC,2,,Number of calls to join a mailing list,Check-2018-02,2018-02-15 07:53:59 UTC,0,,The page of the article has spammy or clickbaity advertisements.,Check-2018-02,2018-02-15 07:54:01 UTC,Somewhat agree,,"The page of the article has aggressively-placed advertisements, social shares and calls to join a mailing list.",Check-2018-02,2018-02-15 07:54:04 UTC,Somewhat disagree,,Rate your impression of the credibility of this article.,Check-2018-02,2018-02-15 07:54:07 UTC,Somewhat high credibility,,2018-02-08 01:48:24 UTC,an xiao mina,This article can still be found at http://archive.is/p2k3O,,,,,
1085,7905,,2017-12-07 11:48:44 UTC,,http://www.iflscience.com/health-and-medicine/coconut-oil-bad/,complete,20062,6033013,,page,3,,52,1,24,24,Rate your impression of the credibility of this article.,Check-2018-02,2018-02-15 07:34:32 UTC,Very low credibility,,Has the text of this article appeared in exactly the same words or very similar words in another publication?,Check-2018-02,2018-02-15 07:35:32 UTC,"B) Appears to be a copy of one or more articles, with some portions different or remixed",https://www.drmorsesherbalhealthclub.com/blogs/media/so-coconut-oil-is-actually-really-really-bad-for-you https://www.usatoday.com/story/news/nation-now/2017/06/16/coconut-oil-isnt-healthy-its-never-been-healthy/402719001/,"If you answered B, C, D, above, was attribution given and if so, was the attribution accurate?",Check-2018-02,2018-02-15 07:35:37 UTC,A) Attribution was not given,,Has the central claim in this article been fact-checked by another source?,Check-2018-02,2018-02-15 07:35:40 UTC,B) Most likely not fact-checked by an approved source,,Is Source 1...,Check-2018-02,2018-02-15 07:35:56 UTC,An organization,,Is a link for Source 1 provided in the article to where the original content came from?,Check-2018-02,2018-02-15 07:36:00 UTC,Yes,http://circ.ahajournals.org/content/early/2017/06/15/CIR.0000000000000510,"If you can find it, paste the impact factor of the journal or conference of Source 1.",Check-2018-02,2018-02-15 07:36:07 UTC,19.309,,This article properly characterizes the methods and conclusions of the cited or quoted source (Source 1).,Check-2018-02,2018-02-15 07:36:18 UTC,Neutral,,Is Source 2...,Check-2018-02,2018-02-15 07:36:40 UTC,An organization,,Is a link for Source 2 provided in the article to where the original content came from?,Check-2018-02,2018-02-15 07:36:43 UTC,Yes,https://www.nhs.uk/Livewell/Goodfood/Pages/Eat-less-saturated-fat.aspx,"If you can find it, paste the impact factor of the journal or conference of Source 2.",Check-2018-02,2018-02-15 07:36:51 UTC,could not locate,,This article properly characterizes the methods and conclusions of the cited or quoted source (Source 2).,Check-2018-02,2018-02-15 07:36:55 UTC,Somewhat agree,,Is Source 3...,Check-2018-02,2018-02-15 07:37:30 UTC,An organization,,Is a link for Source 3 provided in the article to where the original content came from?,Check-2018-02,2018-02-15 07:37:32 UTC,Yes,https://www.davidwolfe.com/2-tablespoons-coconut-oil-health/,"If you can find it, paste the impact factor of the journal or conference of Source 3.",Check-2018-02,2018-02-15 07:37:37 UTC,could not locate,,This article properly characterizes the methods and conclusions of the cited or quoted source (Source 3).,Check-2018-02,2018-02-15 07:37:42 UTC,Neutral,,Number of display ads,Check-2018-02,2018-02-15 07:38:00 UTC,0,,Number of content recommendation boxes,Check-2018-02,2018-02-15 07:38:02 UTC,3,,Number of links to sponsored content,Check-2018-02,2018-02-15 07:38:08 UTC,0,,Number of calls to social shares,Check-2018-02,2018-02-15 07:38:11 UTC,2,,Number of calls to join a mailing list,Check-2018-02,2018-02-15 07:38:20 UTC,0,,The page of the article has spammy or clickbaity advertisements.,Check-2018-02,2018-02-15 07:38:27 UTC,Strongly agree,,"The page of the article has aggressively-placed advertisements, social shares and calls to join a mailing list.",Check-2018-02,2018-02-15 07:38:39 UTC,Strongly disagree,,Rate your impression of the credibility of this article.,Check-2018-02,2018-02-15 07:38:47 UTC,Medium credibility,,2018-02-08 01:48:49 UTC,an xiao mina,This article can still be found at http://archive.is/3Ftua,,,,,
1085,7907,"Surgeon Gen.: Addiction Is A Chronic Brain Disease, Not Moral Failure",2017-12-07 11:51:10 UTC,The way forward includes needle exchanges and calling addiction what it is: a medical condition.,https://www.huffingtonpost.com/entry/vivek-murthy-report-on-drugs-and-alcohol_us_582dce19e4b099512f812e9c,complete,19914,6032550,2016-11-17 19:48:15 +0000,page,2,,49,0,24,22,Rate your impression of the credibility of this article.,Check-2018-02,2018-02-15 07:28:14 UTC,Somewhat high credibility,,Has the text of this article appeared in exactly the same words or very similar words in another publication?,Check-2018-02,2018-02-15 07:28:45 UTC,A) Most likely original,,"If you answered B, C, D, above, was attribution given and if so, was the attribution accurate?",,,,,Has the central claim in this article been fact-checked by another source?,Check-2018-02,2018-02-15 07:29:16 UTC,A) No central claim,,Is Source 1...,Check-2018-02,2018-02-15 07:30:05 UTC,An organization,,Is a link for Source 1 provided in the article to where the original content came from?,Check-2018-02,2018-02-15 07:30:11 UTC,Yes,https://www.cbo.gov/sites/default/files/114th-congress-2015-2016/costestimate/hr3762senatepassed.pdf,"If you can find it, paste the impact factor of the journal or conference of Source 1.",Check-2018-02,2018-02-15 07:30:33 UTC,could not locate,,This article properly characterizes the methods and conclusions of the cited or quoted source (Source 1).,Check-2018-02,2018-02-15 07:30:35 UTC,Strongly agree,,Is Source 2...,Check-2018-02,2018-02-15 07:30:47 UTC,An organization,,Is a link for Source 2 provided in the article to where the original content came from?,Check-2018-02,2018-02-15 07:30:51 UTC,Yes,https://addiction.surgeongeneral.gov/surgeon-generals-report.pdf,"If you can find it, paste the impact factor of the journal or conference of Source 2.",Check-2018-02,2018-02-15 07:31:17 UTC,could not locate,,This article properly characterizes the methods and conclusions of the cited or quoted source (Source 2).,Check-2018-02,2018-02-15 07:31:24 UTC,Strongly agree,,Is Source 3...,Check-2018-02,2018-02-15 07:32:03 UTC,A person,,Is a link for Source 3 provided in the article to where the original content came from?,Check-2018-02,2018-02-15 07:32:08 UTC,No,https://www.npr.org/sections/health-shots/2016/11/17/502402409/surgeon-general-murthy-wants-america-to-face-up-to-addiction,"If you can find it, paste the impact factor of the journal or conference of Source 3.",,,,,This article properly characterizes the methods and conclusions of the cited or quoted source (Source 3).,Check-2018-02,2018-02-15 07:32:27 UTC,Somewhat disagree,,Number of display ads,Check-2018-02,2018-02-15 07:32:39 UTC,0,,Number of content recommendation boxes,Check-2018-02,2018-02-15 07:33:04 UTC,3,,Number of links to sponsored content,Check-2018-02,2018-02-15 07:33:03 UTC,1,,Number of calls to social shares,Check-2018-02,2018-02-15 07:33:17 UTC,4,,Number of calls to join a mailing list,Check-2018-02,2018-02-15 07:33:21 UTC,2,,The page of the article has spammy or clickbaity advertisements.,Check-2018-02,2018-02-15 07:33:27 UTC,Neutral,,"The page of the article has aggressively-placed advertisements, social shares and calls to join a mailing list.",Check-2018-02,2018-02-15 07:33:31 UTC,Somewhat agree,,Rate your impression of the credibility of this article.,Check-2018-02,2018-02-15 07:33:35 UTC,Somewhat high credibility,,,,,,,,,
1085,7909,Stop Calling Your Drug Addiction a Disease,2017-12-07 11:52:00 UTC,"Despite the prevalence of drug addiction in our society and the growing epidemic it has become, drug addiction is no more a disease now than it was, to begin with. Yes, there I said it,",https://awarenessact.com/stop-calling-your-drug-addiction-a-disease/,complete,19861,6032100,2017-07-28 21:20:53 +0000,page,2,,38,0,24,11,Rate your impression of the credibility of this article.,Check-2018-02,2018-02-15 07:25:36 UTC,Medium credibility,,Has the text of this article appeared in exactly the same words or very similar words in another publication?,Check-2018-02,2018-02-15 07:25:40 UTC,A) Most likely original,,"If you answered B, C, D, above, was attribution given and if so, was the attribution accurate?",,,,,Has the central claim in this article been fact-checked by another source?,Check-2018-02,2018-02-15 07:25:56 UTC,A) No central claim,,Is Source 1...,,,,,Is a link for Source 1 provided in the article to where the original content came from?,,,,,"If you can find it, paste the impact factor of the journal or conference of Source 1.",,,,,This article properly characterizes the methods and conclusions of the cited or quoted source (Source 1).,,,,,Is Source 2...,,,,,Is a link for Source 2 provided in the article to where the original content came from?,,,,,"If you can find it, paste the impact factor of the journal or conference of Source 2.",,,,,This article properly characterizes the methods and conclusions of the cited or quoted source (Source 2).,,,,,Is Source 3...,,,,,Is a link for Source 3 provided in the article to where the original content came from?,,,,,"If you can find it, paste the impact factor of the journal or conference of Source 3.",,,,,This article properly characterizes the methods and conclusions of the cited or quoted source (Source 3).,,,,,Number of display ads,Check-2018-02,2018-02-15 07:26:11 UTC,0,,Number of content recommendation boxes,Check-2018-02,2018-02-15 07:26:14 UTC,3,,Number of links to sponsored content,Check-2018-02,2018-02-15 07:26:18 UTC,0,,Number of calls to social shares,Check-2018-02,2018-02-15 07:26:25 UTC,2,,Number of calls to join a mailing list,Check-2018-02,2018-02-15 07:26:30 UTC,0,,The page of the article has spammy or clickbaity advertisements.,Check-2018-02,2018-02-15 07:26:39 UTC,Neutral,,"The page of the article has aggressively-placed advertisements, social shares and calls to join a mailing list.",Check-2018-02,2018-02-15 07:26:46 UTC,Neutral,,Rate your impression of the credibility of this article.,Check-2018-02,2018-02-15 07:26:54 UTC,Medium credibility,Just seems like blog post,,,,,,,,
1085,7911,Five things that just don’t add up about the Las Vegas mass shooting,2017-12-07 11:53:07 UTC,"Our hearts and prayers go out to all those killed or injured in the Las Vegas shooting, and in a nation where so many anti-Americans are kneeling in pampered protest, this mass shooting saw [...]",https://www.naturalnews.com/2017-10-02-five-things-that-just-dont-add-up-about-the-las-vegas-mass-shooting.html,complete,19792,6031619,2017-10-02 09:59:08 +0000,page,2,,45,0,24,18,Rate your impression of the credibility of this article.,Check-2018-02,2018-02-15 07:06:16 UTC,Somewhat low credibility,,Has the text of this article appeared in exactly the same words or very similar words in another publication?,Check-2018-02,2018-02-15 07:07:23 UTC,"B) Appears to be a copy of one or more articles, with some portions different or remixed",http://theeconomiccollapseblog.com/archives/16-unanswered-questions-about-the-las-vegas-shooting-that-the-mainstream-media-doesnt-want-to-talk-about http://www.worldtribune.com/key-unanswered-questions-about-las-vegas-massacre-challenge-emerging-media-narrative/,"If you answered B, C, D, above, was attribution given and if so, was the attribution accurate?",Check-2018-02,2018-02-15 07:07:31 UTC,A) Attribution was not given,,Has the central claim in this article been fact-checked by another source?,Check-2018-02,2018-02-15 07:07:40 UTC,A) No central claim,,Is Source 1...,Check-2018-02,2018-02-15 07:07:48 UTC,An organization,,Is a link for Source 1 provided in the article to where the original content came from?,,,,,"If you can find it, paste the impact factor of the journal or conference of Source 1.",,,,,This article properly characterizes the methods and conclusions of the cited or quoted source (Source 1).,Check-2018-02,2018-02-15 07:17:01 UTC,Somewhat agree,,Is Source 2...,Check-2018-02,2018-02-15 07:17:09 UTC,An organization,,Is a link for Source 2 provided in the article to where the original content came from?,Check-2018-02,2018-02-15 07:17:13 UTC,Yes,https://www.express.co.uk/news/world/861252/Las-Vegas-shooting-latest-news-Mandalay-Bay-Route-91-Marilou-Danley,"If you can find it, paste the impact factor of the journal or conference of Source 2.",Check-2018-02,2018-02-15 07:17:16 UTC,could not locate,,This article properly characterizes the methods and conclusions of the cited or quoted source (Source 2).,Check-2018-02,2018-02-15 07:17:23 UTC,Somewhat agree,,Is Source 3...,,,,,Is a link for Source 3 provided in the article to where the original content came from?,,,,,"If you can find it, paste the impact factor of the journal or conference of Source 3.",,,,,This article properly characterizes the methods and conclusions of the cited or quoted source (Source 3).,,,,,Number of display ads,Check-2018-02,2018-02-15 07:18:23 UTC,12,,Number of content recommendation boxes,Check-2018-02,2018-02-15 07:18:54 UTC,2,,Number of links to sponsored content,Check-2018-02,2018-02-15 07:19:16 UTC,16,,Number of calls to social shares,Check-2018-02,2018-02-15 07:19:42 UTC,14,,Number of calls to join a mailing list,Check-2018-02,2018-02-15 07:19:43 UTC,2,,The page of the article has spammy or clickbaity advertisements.,Check-2018-02,2018-02-15 07:19:45 UTC,Strongly agree,,"The page of the article has aggressively-placed advertisements, social shares and calls to join a mailing list.",Check-2018-02,2018-02-15 07:19:47 UTC,Strongly agree,,Rate your impression of the credibility of this article.,Check-2018-02,2018-02-15 07:19:57 UTC,Medium credibility,,,,,,,,,
1085,7913,Dirt Is Good': Why Kids Need Exposure To Germs,2017-12-07 11:54:22 UTC,"Should I use antibacterial soaps? How often should I bathe my child? Those are just some of the questions Jack Gilbert, a microbiome scientist, answers in his new book.",https://www.npr.org/sections/health-shots/2017/07/16/537075018/dirt-is-good-why-kids-need-exposure-to-germs,complete,19717,6030560,,page,2,,38,0,24,11,Rate your impression of the credibility of this article.,Check-2018-02,2018-02-15 06:58:49 UTC,Very high credibility,,Has the text of this article appeared in exactly the same words or very similar words in another publication?,Check-2018-02,2018-02-15 06:59:53 UTC,A) Most likely original,,"If you answered B, C, D, above, was attribution given and if so, was the attribution accurate?",,,,,Has the central claim in this article been fact-checked by another source?,Check-2018-02,2018-02-15 07:00:37 UTC,A) No central claim,,Is Source 1...,,,,,Is a link for Source 1 provided in the article to where the original content came from?,,,,,"If you can find it, paste the impact factor of the journal or conference of Source 1.",,,,,This article properly characterizes the methods and conclusions of the cited or quoted source (Source 1).,,,,,Is Source 2...,,,,,Is a link for Source 2 provided in the article to where the original content came from?,,,,,"If you can find it, paste the impact factor of the journal or conference of Source 2.",,,,,This article properly characterizes the methods and conclusions of the cited or quoted source (Source 2).,,,,,Is Source 3...,,,,,Is a link for Source 3 provided in the article to where the original content came from?,,,,,"If you can find it, paste the impact factor of the journal or conference of Source 3.",,,,,This article properly characterizes the methods and conclusions of the cited or quoted source (Source 3).,,,,,Number of display ads,Check-2018-02,2018-02-15 07:02:37 UTC,0,,Number of content recommendation boxes,Check-2018-02,2018-02-15 07:02:48 UTC,1,,Number of links to sponsored content,Check-2018-02,2018-02-15 07:02:55 UTC,0,,Number of calls to social shares,Check-2018-02,2018-02-15 07:03:18 UTC,8,,Number of calls to join a mailing list,Check-2018-02,2018-02-15 07:03:19 UTC,1,,The page of the article has spammy or clickbaity advertisements.,Check-2018-02,2018-02-15 07:03:24 UTC,Strongly disagree,,"The page of the article has aggressively-placed advertisements, social shares and calls to join a mailing list.",Check-2018-02,2018-02-15 07:03:26 UTC,Strongly disagree,,Rate your impression of the credibility of this article.,Check-2018-02,2018-02-15 07:03:29 UTC,Very high credibility,,,,,,,,,
