1085,7879,Psychologists believe Trump is showing signs of severe mental illness,2017-12-07 11:33:31 UTC,"Hillary Clinton claimed Trump was “temperamentally unfit” to be President, and in recent months many people the world over have reached the same conclusion. Clinton was, of course, Trump’s political opponent, but some psychologists have now started questioning his state of mind.",https://www.independent.co.uk/life-style/health-and-families/donald-trump-mental-illness-narcisissm-us-president-psychologists-inauguration-crowd-size-paranoia-a7552661.html,complete,21031,1352651,2017-01-30 10:29:08 +0000,page,2,,50,0,24,23,Rate your impression of the credibility of this article.,Check-2018-01,2017-12-23 03:01:39 UTC,Somewhat high credibility,,Has the text of this article appeared in exactly the same words or very similar words in another publication?,Check-2018-01,2017-12-23 03:02:28 UTC,A) Most likely original,,"If you answered B, C, D, above, was attribution given and if so, was the attribution accurate?",,,,,Has the central claim in this article been fact-checked by another source?,Check-2018-01,2017-12-23 03:09:29 UTC,D) Fact-checked and determined true,,Is Source 1...,Check-2018-01,2017-12-23 03:11:15 UTC,An organization,http://www.independent.co.uk/news/world/americas/us-elections/us-election-2016-clinton-takes-the-gloves-off-in-forceful-attack-on-trump-foreign-policy-a7062471.html,Is a link for Source 1 provided in the article to where the original content came from?,Check-2018-01,2017-12-23 03:11:23 UTC,Yes,http://www.independent.co.uk/news/world/americas/us-elections/us-election-2016-clinton-takes-the-gloves-off-in-forceful-attack-on-trump-foreign-policy-a7062471.html,"If you can find it, paste the impact factor of the journal or conference of Source 1.",Check-2018-01,2017-12-23 03:11:49 UTC,http://www.independent.co.uk/,,This article properly characterizes the methods and conclusions of the cited or quoted source (Source 1).,Check-2018-01,2017-12-23 03:12:05 UTC,Strongly agree,,Is Source 2...,Check-2018-01,2017-12-23 03:12:52 UTC,An organization,https://www.usnews.com/news/the-report/articles/2017-01-27/does-donald-trumps-personality-make-him-dangerous?src=usn_tw,Is a link for Source 2 provided in the article to where the original content came from?,Check-2018-01,2017-12-23 03:13:30 UTC,Yes,,"If you can find it, paste the impact factor of the journal or conference of Source 2.",Check-2018-01,2017-12-23 03:13:54 UTC,https://www.usnews.com,,This article properly characterizes the methods and conclusions of the cited or quoted source (Source 2).,Check-2018-01,2017-12-23 03:14:02 UTC,Strongly agree,,Is Source 3...,Check-2018-01,2017-12-23 03:14:36 UTC,An organization,http://www.nydailynews.com/news/politics/shrinks-break-silence-president-trump-exhibits-traits-m-article-1.2957688,Is a link for Source 3 provided in the article to where the original content came from?,Check-2018-01,2017-12-23 03:14:43 UTC,Yes,http://www.nydailynews.com/news/politics/shrinks-break-silence-president-trump-exhibits-traits-m-article-1.2957688,"If you can find it, paste the impact factor of the journal or conference of Source 3.",Check-2018-01,2017-12-23 03:14:56 UTC,http://www.nydailynews.com/,,This article properly characterizes the methods and conclusions of the cited or quoted source (Source 3).,Check-2018-01,2017-12-23 03:15:04 UTC,Strongly agree,,Number of display ads,Check-2018-01,2017-12-23 03:16:01 UTC,5,,Number of content recommendation boxes,Check-2018-01,2017-12-23 03:16:21 UTC,1,,Number of links to sponsored content,Check-2018-01,2017-12-23 03:16:32 UTC,3,,Number of calls to social shares,Check-2018-01,2017-12-23 03:16:47 UTC,2,,Number of calls to join a mailing list,Check-2018-01,2017-12-23 03:17:10 UTC,0,,The page of the article has spammy or clickbaity advertisements.,Check-2018-01,2017-12-23 03:17:19 UTC,Somewhat disagree,,"The page of the article has aggressively-placed advertisements, social shares and calls to join a mailing list.",Check-2018-01,2017-12-23 03:17:26 UTC,Strongly disagree,,"After having finished the above, please rate your impression of the credibility of this article. if your impression hasn't changed, select ""no change.""",Check-2018-01,2017-12-23 03:17:31 UTC,No change,,,,,,,,,
1085,7885,"Nations Press: PLS SHARE: DO NOT EAT THIS FISH, IT IS VERY DANGEROUS FOR YOUR HEALTH!",2017-12-07 11:36:21 UTC,,http://www.nationspressph.com/2017/02/pls-share-do-not-eat-this-fish-it-is.html,complete,20861,1259116,,page,2,,43,0,24,16,Rate your impression of the credibility of this article.,Check-2018-01,2017-12-22 00:58:07 UTC,Very low credibility,,Has the text of this article appeared in exactly the same words or very similar words in another publication?,Check-2018-01,2017-12-22 01:00:46 UTC,A) Most likely original,,"If you answered B, C, D, above, was attribution given and if so, was the attribution accurate?",Check-2018-01,2017-12-22 01:03:11 UTC,C) Attribution was given and was accurate,"I can tell this is an original article because another website cited this blog, but the way it's formatted makes it seem like propaganda ... it doesn't seem ""official,"" which I guess is to be expected, since it's a blog            
https://fishingfunnel.com/blogs/fishing-adventure/why-we-should-not-eat-this-fish --> until I saw this: https://www.youtube.com/watch?time_continue=100&v=IdoVgveiZO0",Has the central claim in this article been fact-checked by another source?,Check-2018-01,2017-12-22 01:06:31 UTC,B) Most likely not fact-checked by an approved source,,Is Source 1...,Check-2018-01,2017-12-22 01:06:57 UTC,A person,https://www.youtube.com/watch?time_continue=100&v=IdoVgveiZO0,Is a link for Source 1 provided in the article to where the original content came from?,Check-2018-01,2017-12-22 01:21:07 UTC,Yes,,"If you can find it, paste the impact factor of the journal or conference of Source 1.",Check-2018-01,2017-12-22 01:21:18 UTC,Could not locate,,This article properly characterizes the methods and conclusions of the cited or quoted source (Source 1).,Check-2018-01,2017-12-22 01:21:22 UTC,Somewhat agree,,Is Source 2...,,,,,Is a link for Source 2 provided in the article to where the original content came from?,,,,,"If you can find it, paste the impact factor of the journal or conference of Source 2.",,,,,This article properly characterizes the methods and conclusions of the cited or quoted source (Source 2).,,,,,Is Source 3...,,,,,Is a link for Source 3 provided in the article to where the original content came from?,,,,,"If you can find it, paste the impact factor of the journal or conference of Source 3.",,,,,This article properly characterizes the methods and conclusions of the cited or quoted source (Source 3).,,,,,Number of display ads,Check-2018-01,2017-12-22 01:19:42 UTC,3,,Number of content recommendation boxes,Check-2018-01,2017-12-22 01:19:56 UTC,6,,Number of links to sponsored content,Check-2018-01,2017-12-22 01:19:23 UTC,1,,Number of calls to social shares,Check-2018-01,2017-12-22 01:19:18 UTC,5,,Number of calls to join a mailing list,Check-2018-01,2017-12-22 01:19:16 UTC,2,,The page of the article has spammy or clickbaity advertisements.,Check-2018-01,2017-12-22 01:19:03 UTC,Strongly agree,,"The page of the article has aggressively-placed advertisements, social shares and calls to join a mailing list.",Check-2018-01,2017-12-22 01:19:07 UTC,Strongly agree,,"After having finished the above, please rate your impression of the credibility of this article. if your impression hasn't changed, select ""no change.""",Check-2018-01,2017-12-22 01:21:29 UTC,Somewhat high credibility,,,,,,,,,
1085,7887,"Preventing Alzheimer's Disease, Dementia & Cognitive Decline With Diet",2017-12-07 11:37:43 UTC,"Preventing Alzheimer's naturally is as simple as changing your diet and a few lifestyle habits to reset your brain, free PDF included.",https://dailyhealthpost.com/preventing-alzheimers/,complete,20779,1257534,2017-10-03 06:15:19 +0000,page,2,,50,0,24,23,Rate your impression of the credibility of this article.,Check-2018-01,2017-12-22 00:34:45 UTC,Very high credibility,,Has the text of this article appeared in exactly the same words or very similar words in another publication?,Check-2018-01,2017-12-22 00:35:20 UTC,"B) Appears to be a copy of one or more articles, with some portions different or remixed",,"If you answered B, C, D, above, was attribution given and if so, was the attribution accurate?",Check-2018-01,2017-12-22 00:35:38 UTC,C) Attribution was given and was accurate,,Has the central claim in this article been fact-checked by another source?,Check-2018-01,2017-12-22 00:38:13 UTC,B) Most likely not fact-checked by an approved source,,Is Source 1...,Check-2018-01,2017-12-22 00:38:59 UTC,An organization,Alzheimer's Association,Is a link for Source 1 provided in the article to where the original content came from?,Check-2018-01,2017-12-22 00:42:42 UTC,Yes,https://www.alz.org/what-is-dementia.asp,"If you can find it, paste the impact factor of the journal or conference of Source 1.",Check-2018-01,2017-12-22 00:42:52 UTC,https://www.alz.org/,,This article properly characterizes the methods and conclusions of the cited or quoted source (Source 1).,Check-2018-01,2017-12-22 00:42:57 UTC,Strongly agree,,Is Source 2...,Check-2018-01,2017-12-22 00:43:16 UTC,An organization,https://www.alz.org/facts/,Is a link for Source 2 provided in the article to where the original content came from?,Check-2018-01,2017-12-22 00:43:21 UTC,Yes,https://www.alz.org/facts/,"If you can find it, paste the impact factor of the journal or conference of Source 2.",Check-2018-01,2017-12-22 00:43:57 UTC,alz.org,,This article properly characterizes the methods and conclusions of the cited or quoted source (Source 2).,Check-2018-01,2017-12-22 00:48:35 UTC,Strongly agree,,Is Source 3...,Check-2018-01,2017-12-22 00:51:29 UTC,An organization,http://www.alzheimer.ca/en/Home/About-dementia/Alzheimer-s-disease/Risk-factors,Is a link for Source 3 provided in the article to where the original content came from?,Check-2018-01,2017-12-22 00:51:41 UTC,Yes,http://www.alzheimer.ca/en/Home/About-dementia/Alzheimer-s-disease/Risk-factors,"If you can find it, paste the impact factor of the journal or conference of Source 3.",Check-2018-01,2017-12-22 00:52:04 UTC,http://www.alzheimer.ca/,,This article properly characterizes the methods and conclusions of the cited or quoted source (Source 3).,Check-2018-01,2017-12-22 00:53:24 UTC,Strongly agree,,Number of display ads,,,,,Number of content recommendation boxes,Check-2018-01,2017-12-22 00:54:53 UTC,5,,Number of links to sponsored content,Check-2018-01,2017-12-22 00:56:05 UTC,5,,Number of calls to social shares,Check-2018-01,2017-12-22 00:55:19 UTC,8,,Number of calls to join a mailing list,Check-2018-01,2017-12-22 00:55:59 UTC,2,,The page of the article has spammy or clickbaity advertisements.,Check-2018-01,2017-12-22 00:55:57 UTC,Somewhat agree,,"The page of the article has aggressively-placed advertisements, social shares and calls to join a mailing list.",Check-2018-01,2017-12-22 00:56:13 UTC,Somewhat agree,,"After having finished the above, please rate your impression of the credibility of this article. if your impression hasn't changed, select ""no change.""",Check-2018-01,2017-12-22 00:56:17 UTC,Very high credibility,,,,,,,,,
1085,7891,"Under the GOP's health plan, sexual assault could be considered a pre-existing condition",2017-12-07 11:40:05 UTC,The bill would also mean insurers could consider having postpartum depression or surviving domestic abuse pre-existing conditions.,https://mic.com/articles/176092/under-the-gop-s-health-plan-sexual-assault-would-be-considered-a-preexisting-condition,complete,20637,1254536,,page,2,,47,0,24,20,Rate your impression of the credibility of this article.,Check-2018-01,2017-12-21 02:10:56 UTC,Somewhat high credibility,,Has the text of this article appeared in exactly the same words or very similar words in another publication?,Check-2018-01,2017-12-21 02:12:24 UTC,A) Most likely original,,"If you answered B, C, D, above, was attribution given and if so, was the attribution accurate?",,,,,Has the central claim in this article been fact-checked by another source?,Check-2018-01,2017-12-21 02:13:20 UTC,B) Most likely not fact-checked by an approved source,,Is Source 1...,Check-2018-01,2017-12-21 02:13:59 UTC,https://www.huffingtonpost.com/2009/10/27/woman-denied-health-care_n_335000.html,,Is a link for Source 1 provided in the article to where the original content came from?,Check-2018-01,2017-12-21 02:14:05 UTC,Yes,,"If you can find it, paste the impact factor of the journal or conference of Source 1.",,,,,This article properly characterizes the methods and conclusions of the cited or quoted source (Source 1).,Check-2018-01,2017-12-21 02:15:03 UTC,Somewhat agree,,Is Source 2...,Check-2018-01,2017-12-21 02:15:41 UTC,http://www.elle.com/culture/career-politics/news/a44995/ahca-20-would-disproportionately-affect-women/,,Is a link for Source 2 provided in the article to where the original content came from?,Check-2018-01,2017-12-21 02:15:51 UTC,Yes,http://www.elle.com/culture/career-politics/news/a44995/ahca-20-would-disproportionately-affect-women/,"If you can find it, paste the impact factor of the journal or conference of Source 2.",,,,,This article properly characterizes the methods and conclusions of the cited or quoted source (Source 2).,Check-2018-01,2017-12-21 02:18:28 UTC,Somewhat agree,,Is Source 3...,Check-2018-01,2017-12-21 02:22:22 UTC,A person,https://www.alternet.org/story/143426/rape_is_a_pre-existing_condition_the_heartlessness_of_the_health_insurance_industry_exposed,Is a link for Source 3 provided in the article to where the original content came from?,Check-2018-01,2017-12-21 02:22:51 UTC,No,,"If you can find it, paste the impact factor of the journal or conference of Source 3.",Check-2018-01,2017-12-21 02:23:15 UTC,https://www.alternet.org/,,This article properly characterizes the methods and conclusions of the cited or quoted source (Source 3).,Check-2018-01,2017-12-21 02:23:25 UTC,Somewhat agree,,Number of display ads,Check-2018-01,2017-12-21 02:24:01 UTC,2,,Number of content recommendation boxes,Check-2018-01,2017-12-21 02:26:54 UTC,1,,Number of links to sponsored content,Check-2018-01,2017-12-21 02:25:10 UTC,0,,Number of calls to social shares,Check-2018-01,2017-12-21 02:24:59 UTC,3,,Number of calls to join a mailing list,,,,,The page of the article has spammy or clickbaity advertisements.,Check-2018-01,2017-12-21 02:27:14 UTC,Somewhat agree,,"The page of the article has aggressively-placed advertisements, social shares and calls to join a mailing list.",Check-2018-01,2017-12-21 02:27:20 UTC,Somewhat disagree,,"After having finished the above, please rate your impression of the credibility of this article. if your impression hasn't changed, select ""no change.""",Check-2018-01,2017-12-21 02:27:25 UTC,Somewhat high credibility,,,,,,,,,
1085,7895,The Best Exercise for Aging Muscles,2017-12-07 11:43:20 UTC,Certain kinds of exercise may mitigate the effects of aging at the cellular level.,https://www.nytimes.com/2017/03/23/well/move/the-best-exercise-for-aging-muscles.html,complete,20398,6036163,,page,2,,41,0,24,14,Rate your impression of the credibility of this article.,Check-2018-02,2018-02-15 08:23:55 UTC,Very high credibility,,Has the text of this article appeared in exactly the same words or very similar words in another publication?,Check-2018-02,2018-02-15 08:23:59 UTC,A) Most likely original,,"If you answered B, C, D, above, was attribution given and if so, was the attribution accurate?",,,,,Has the central claim in this article been fact-checked by another source?,Check-2018-02,2018-02-15 08:24:42 UTC,B) Most likely not fact-checked by an approved source,,Is Source 1...,Check-2018-02,2018-02-15 08:24:46 UTC,A scientific study,,Is a link for Source 1 provided in the article to where the original content came from?,Check-2018-02,2018-02-15 08:24:51 UTC,Yes,http://www.cell.com/cell-metabolism/fulltext/S1550-4131(17)30099-2,"If you can find it, paste the impact factor of the journal or conference of Source 1.",Check-2018-02,2018-02-15 08:25:18 UTC,18.164,,This article properly characterizes the methods and conclusions of the cited or quoted source (Source 1).,,,,,Is Source 2...,,,,,Is a link for Source 2 provided in the article to where the original content came from?,,,,,"If you can find it, paste the impact factor of the journal or conference of Source 2.",,,,,This article properly characterizes the methods and conclusions of the cited or quoted source (Source 2).,,,,,Is Source 3...,,,,,Is a link for Source 3 provided in the article to where the original content came from?,,,,,"If you can find it, paste the impact factor of the journal or conference of Source 3.",,,,,This article properly characterizes the methods and conclusions of the cited or quoted source (Source 3).,,,,,Number of display ads,Check-2018-02,2018-02-15 08:25:41 UTC,0,,Number of content recommendation boxes,Check-2018-02,2018-02-15 08:25:44 UTC,4,,Number of links to sponsored content,Check-2018-02,2018-02-15 08:25:48 UTC,0,,Number of calls to social shares,Check-2018-02,2018-02-15 08:25:51 UTC,5,,Number of calls to join a mailing list,Check-2018-02,2018-02-15 08:25:54 UTC,1,,The page of the article has spammy or clickbaity advertisements.,Check-2018-02,2018-02-15 08:25:56 UTC,Strongly disagree,,"The page of the article has aggressively-placed advertisements, social shares and calls to join a mailing list.",Check-2018-02,2018-02-15 08:25:59 UTC,Strongly disagree,,Rate your impression of the credibility of this article.,Check-2018-02,2018-02-15 08:26:01 UTC,Very high credibility,,,,,,,,,
1085,7896,Arctic stronghold of world’s seeds flooded after permafrost melts,2017-12-07 11:45:03 UTC,No seeds were lost but the ability of the rock vault to provide failsafe protection against all disasters is now threatened by climate change,https://www.theguardian.com/environment/2017/may/19/arctic-stronghold-of-worlds-seeds-flooded-after-permafrost-melts,complete,20292,6035917,2017-05-19 15:39:36 +0000,page,2,,50,0,24,23,Rate your impression of the credibility of this article.,Check-2018-02,2018-02-15 08:19:05 UTC,Very high credibility,,Has the text of this article appeared in exactly the same words or very similar words in another publication?,Check-2018-02,2018-02-15 08:19:57 UTC,A) Most likely original,,"If you answered B, C, D, above, was attribution given and if so, was the attribution accurate?",,,,,Has the central claim in this article been fact-checked by another source?,Check-2018-02,2018-02-15 08:20:25 UTC,B) Most likely not fact-checked by an approved source,,Is Source 1...,Check-2018-02,2018-02-15 08:21:14 UTC,An organization,,Is a link for Source 1 provided in the article to where the original content came from?,Check-2018-02,2018-02-15 08:21:17 UTC,Yes,https://www.regjeringen.no/en/topics/food-fisheries-and-agriculture/svalbard-global-seed-vault/id462220/,"If you can find it, paste the impact factor of the journal or conference of Source 1.",Check-2018-02,2018-02-15 08:21:21 UTC,could not locate,,This article properly characterizes the methods and conclusions of the cited or quoted source (Source 1).,Check-2018-02,2018-02-15 08:21:27 UTC,Strongly agree,,Is Source 2...,Check-2018-02,2018-02-15 08:21:35 UTC,An organization,,Is a link for Source 2 provided in the article to where the original content came from?,Check-2018-02,2018-02-15 08:21:37 UTC,Yes,https://www.theguardian.com/environment/2016/nov/22/extraordinarily-hot-arctic-temperatures-alarm-scientists,"If you can find it, paste the impact factor of the journal or conference of Source 2.",Check-2018-02,2018-02-15 08:21:41 UTC,could not locate,,This article properly characterizes the methods and conclusions of the cited or quoted source (Source 2).,Check-2018-02,2018-02-15 08:21:43 UTC,Unable to find source,,Is Source 3...,Check-2018-02,2018-02-15 08:22:19 UTC,An organization,,Is a link for Source 3 provided in the article to where the original content came from?,Check-2018-02,2018-02-15 08:22:22 UTC,Yes,https://www.theguardian.com/environment/2017/jan/18/2016-hottest-year-ever-recorded-and-scientists-say-human-activity-to-blame,"If you can find it, paste the impact factor of the journal or conference of Source 3.",Check-2018-02,2018-02-15 08:22:27 UTC,could not locate,,This article properly characterizes the methods and conclusions of the cited or quoted source (Source 3).,Check-2018-02,2018-02-15 08:22:32 UTC,Unable to find source,,Number of display ads,Check-2018-02,2018-02-15 08:23:02 UTC,0,,Number of content recommendation boxes,Check-2018-02,2018-02-15 08:23:03 UTC,2,,Number of links to sponsored content,Check-2018-02,2018-02-15 08:23:09 UTC,0,,Number of calls to social shares,Check-2018-02,2018-02-15 08:23:14 UTC,4,,Number of calls to join a mailing list,Check-2018-02,2018-02-15 08:23:18 UTC,2,,The page of the article has spammy or clickbaity advertisements.,Check-2018-02,2018-02-15 08:23:21 UTC,Strongly disagree,,"The page of the article has aggressively-placed advertisements, social shares and calls to join a mailing list.",Check-2018-02,2018-02-15 08:23:28 UTC,Strongly disagree,,Rate your impression of the credibility of this article.,Check-2018-02,2018-02-15 08:23:31 UTC,Very high credibility,,,,,,,,,
1085,7899,"The oldest child is actually the smartest, study finds",2017-12-07 11:45:52 UTC,"Birth order doesn't affect personality, but it does set certain siblings up for more success, new research has found.",https://www.today.com/health/birth-order-first-borns-get-intellectual-advantage-t108042,complete,20243,6035548,,page,2,,46,0,24,19,Rate your impression of the credibility of this article.,Check-2018-02,2018-02-15 08:10:45 UTC,Very high credibility,,Has the text of this article appeared in exactly the same words or very similar words in another publication?,Check-2018-02,2018-02-15 08:13:04 UTC,A) Most likely original,,"If you answered B, C, D, above, was attribution given and if so, was the attribution accurate?",,,,,Has the central claim in this article been fact-checked by another source?,Check-2018-02,2018-02-15 08:13:13 UTC,B) Most likely not fact-checked by an approved source,,Is Source 1...,Check-2018-02,2018-02-15 08:13:50 UTC,A scientific study,,Is a link for Source 1 provided in the article to where the original content came from?,Check-2018-02,2018-02-15 08:13:54 UTC,Yes,http://jhr.uwpress.org/content/early/2016/11/01/jhr.53.1.0816-8177.abstract,"If you can find it, paste the impact factor of the journal or conference of Source 1.",Check-2018-02,2018-02-15 08:14:16 UTC,2.371,,This article properly characterizes the methods and conclusions of the cited or quoted source (Source 1).,Check-2018-02,2018-02-15 08:14:30 UTC,Somewhat agree,,Is Source 2...,Check-2018-02,2018-02-15 08:16:36 UTC,An organization,,Is a link for Source 2 provided in the article to where the original content came from?,Check-2018-02,2018-02-15 08:16:38 UTC,Yes,https://www.nlsinfo.org/content/cohorts/nlsy79-children,"If you can find it, paste the impact factor of the journal or conference of Source 2.",Check-2018-02,2018-02-15 08:16:42 UTC,could not locate,,This article properly characterizes the methods and conclusions of the cited or quoted source (Source 2).,Check-2018-02,2018-02-15 08:16:47 UTC,Strongly agree,,Is Source 3...,,,,,Is a link for Source 3 provided in the article to where the original content came from?,,,,,"If you can find it, paste the impact factor of the journal or conference of Source 3.",,,,,This article properly characterizes the methods and conclusions of the cited or quoted source (Source 3).,,,,,Number of display ads,Check-2018-02,2018-02-15 08:17:25 UTC,0,,Number of content recommendation boxes,Check-2018-02,2018-02-15 08:17:37 UTC,3,,Number of links to sponsored content,Check-2018-02,2018-02-15 08:17:43 UTC,0,,Number of calls to social shares,Check-2018-02,2018-02-15 08:18:04 UTC,21,,Number of calls to join a mailing list,Check-2018-02,2018-02-15 08:18:06 UTC,1,,The page of the article has spammy or clickbaity advertisements.,Check-2018-02,2018-02-15 08:18:08 UTC,Neutral,,"The page of the article has aggressively-placed advertisements, social shares and calls to join a mailing list.",Check-2018-02,2018-02-15 08:18:11 UTC,Strongly agree,,Rate your impression of the credibility of this article.,Check-2018-02,2018-02-15 08:18:15 UTC,Somewhat high credibility,,,,,,,,,
