project_id,report_id,report_title,report_date,media_content,media_url,report_status,time_delta_to_first_status,time_delta_to_last_status,time_original_media_publishing,type,contributing_users,tags,notes_count,notes_ugc_count,tasks_count,tasks_resolved_count,task_question_1,task_user_1,task_date_1,task_answer_1,task_note_1,task_question_2,task_user_2,task_date_2,task_answer_2,task_note_2,task_question_3,task_user_3,task_date_3,task_answer_3,task_note_3,task_question_4,task_user_4,task_date_4,task_answer_4,task_note_4,task_question_5,task_user_5,task_date_5,task_answer_5,task_note_5,task_question_6,task_user_6,task_date_6,task_answer_6,task_note_6,task_question_7,task_user_7,task_date_7,task_answer_7,task_note_7,task_question_8,task_user_8,task_date_8,task_answer_8,task_note_8,task_question_9,task_user_9,task_date_9,task_answer_9,task_note_9,task_question_10,task_user_10,task_date_10,task_answer_10,task_note_10,task_question_11,task_user_11,task_date_11,task_answer_11,task_note_11,task_question_12,task_user_12,task_date_12,task_answer_12,task_note_12,task_question_13,task_user_13,task_date_13,task_answer_13,task_note_13,task_question_14,task_user_14,task_date_14,task_answer_14,task_note_14,task_question_15,task_user_15,task_date_15,task_answer_15,task_note_15,task_question_16,task_user_16,task_date_16,task_answer_16,task_note_16,task_question_17,task_user_17,task_date_17,task_answer_17,task_note_17,task_question_18,task_user_18,task_date_18,task_answer_18,task_note_18,task_question_19,task_user_19,task_date_19,task_answer_19,task_note_19,task_question_20,task_user_20,task_date_20,task_answer_20,task_note_20,task_question_21,task_user_21,task_date_21,task_answer_21,task_note_21,task_question_22,task_user_22,task_date_22,task_answer_22,task_note_22,task_question_23,task_user_23,task_date_23,task_answer_23,task_note_23,task_question_24,task_user_24,task_date_24,task_answer_24,task_note_24,note_date_1,note_user_1,note_content_1,task_question_25,task_user_25,task_date_25,task_answer_25,task_note_25
1085,7824,Johns Hopkins Researcher Releases Shocking Report On Flu Vaccines,2017-12-07 02:25:16 UTC,"In 2015, a whole new slew of flu vaccines found themselves getting approved by the Federal Drug Administration. This isn't an uncommon practice; most flu vaccines pass inspection every year. It's well known advice that has been passed down from doctor to patient that the flu vaccine is something that we all should get, but it has been quickly surfacing that what's in the vaccines--especially those from 2015 and after--might actually be more damaging then simply rolling the dice on getting the flu. The ingredient that is getting the most flack is called an adjuvant. The particular one involved is called Squalene, and it has been linked to auto-immune disease side effects. In fact, it may have been used during chemical attacks in the Gulf War. Symptoms include chronic fatigue, muscle aches, and neurologic damage. While it may be a contested subject, it remains that we aren't really sure what's going into these vaccines we're being convinced should be used. A scientist who has been",https://ewao.com/2017/08/16/johns-hopkins-researcher-releases-shocking-report-on-flu-vaccines/,complete,53966,1287793,2017-08-16 06:59:21 +0000,page,2,,46,0,24,19,Rate your impression of the credibility of this article.,Check-2018-01,2017-12-21 23:48:38 UTC,Somewhat low credibility,,Has the text of this article appeared in exactly the same words or very similar words in another publication?,Check-2018-01,2017-12-21 23:50:25 UTC,A) Most likely original,,"If you answered B, C, D, above, was attribution given and if so, was the attribution accurate?",,,,,Has the central claim in this article been fact-checked by another source?,Check-2018-01,2017-12-21 23:52:01 UTC,D) Fact-checked and determined true,,Is Source 1...,Check-2018-01,2017-12-21 23:53:37 UTC,A scientific study,Scientist from John Hopkins,Is a link for Source 1 provided in the article to where the original content came from?,Check-2018-01,2017-12-21 23:54:20 UTC,Yes,http://yournewswire.com/johns-hopkins-scientist-reveals-shocking-report-on-flu-vaccines/,"If you can find it, paste the impact factor of the journal or conference of Source 1.",Check-2018-01,2017-12-21 23:54:37 UTC,yournewswire.com,It was especially credible that they linked to the actual study,This article properly characterizes the methods and conclusions of the cited or quoted source (Source 1).,Check-2018-01,2017-12-21 23:57:26 UTC,Strongly agree,,Is Source 2...,Check-2018-01,2017-12-22 00:06:10 UTC,A person,http://yournewswire.com/johns-hopkins-scientist-reveals-shocking-report-on-flu-vaccines/,Is a link for Source 2 provided in the article to where the original content came from?,Check-2018-01,2017-12-22 00:06:58 UTC,No,https://w3.blaylockwellness.com/Health/BWR/Offers/BWR-Renewal,"If you can find it, paste the impact factor of the journal or conference of Source 2.",Check-2018-01,2017-12-22 00:07:29 UTC,https://w3.blaylockwellness.com/Health/BWR/Offers/BWR-Renewal,,This article properly characterizes the methods and conclusions of the cited or quoted source (Source 2).,Check-2018-01,2017-12-22 00:07:37 UTC,Strongly agree,,Is Source 3...,,,,,Is a link for Source 3 provided in the article to where the original content came from?,,,,,"If you can find it, paste the impact factor of the journal or conference of Source 3.",,,,,This article properly characterizes the methods and conclusions of the cited or quoted source (Source 3).,,,,,Number of display ads,Check-2018-01,2017-12-21 23:43:29 UTC,6,,Number of content recommendation boxes,Check-2018-01,2017-12-21 23:44:01 UTC,1,,Number of links to sponsored content,Check-2018-01,2017-12-21 23:44:51 UTC,1,,Number of calls to social shares,Check-2018-01,2017-12-21 23:45:10 UTC,1,,Number of calls to join a mailing list,Check-2018-01,2017-12-21 23:45:20 UTC,0,,The page of the article has spammy or clickbaity advertisements.,Check-2018-01,2017-12-21 23:45:26 UTC,Strongly agree,,"The page of the article has aggressively-placed advertisements, social shares and calls to join a mailing list.",Check-2018-01,2017-12-21 23:45:38 UTC,Strongly agree,,"After having finished the above, please rate your impression of the credibility of this article. if your impression hasn't changed, select ""no change.""",Check-2018-01,2017-12-22 00:08:12 UTC,Medium credibility,,,,,,,,,
1085,7835,"Floods in India, Bangladesh and Nepal kill 1,200 and leave millions homeless",2017-12-07 11:00:56 UTC,"At least 1,200 people have been killed and millions have been left homeless following devastating floods that have hit India, Bangladesh and Nepal, in one of the worst flooding disasters to have affected the region in years. International aid agencies said thousands of villages have been cut off by flooding with people being deprived of food and clean water for days.  South Asia suffers from frequent flooding during the monsoon season, which lasts from June to September, but authorities have said this year's floods have been much worse. ",https://www.independent.co.uk/news/world/asia/india-floods-bangladesh-nepal-deaths-millions-homeless-latest-news-updates-a7919006.html,complete,23026,1262622,2017-08-29 17:32:14 +0000,page,2,,51,0,24,24,Rate your impression of the credibility of this article.,Check-2018-01,2017-12-22 01:39:26 UTC,Very high credibility,,Has the text of this article appeared in exactly the same words or very similar words in another publication?,Check-2018-01,2017-12-22 01:39:51 UTC,"B) Appears to be a copy of one or more articles, with some portions different or remixed",,"If you answered B, C, D, above, was attribution given and if so, was the attribution accurate?",Check-2018-01,2017-12-22 01:40:06 UTC,C) Attribution was given and was accurate,http://www.straitstimes.com/asia/south-asia/death-toll-in-floods-in-eastern-indian-state-of-bihar-hits-514,Has the central claim in this article been fact-checked by another source?,Check-2018-01,2017-12-22 01:40:12 UTC,D) Fact-checked and determined true,,Is Source 1...,Check-2018-01,2017-12-22 01:40:22 UTC,An organization,http://www.straitstimes.com/asia/south-asia/death-toll-in-floods-in-eastern-indian-state-of-bihar-hits-514,Is a link for Source 1 provided in the article to where the original content came from?,Check-2018-01,2017-12-22 01:40:29 UTC,Yes,http://www.straitstimes.com/asia/south-asia/death-toll-in-floods-in-eastern-indian-state-of-bihar-hits-514,"If you can find it, paste the impact factor of the journal or conference of Source 1.",Check-2018-01,2017-12-22 01:40:45 UTC,http://www.straitstimes.com,,This article properly characterizes the methods and conclusions of the cited or quoted source (Source 1).,Check-2018-01,2017-12-22 01:40:55 UTC,Strongly agree,,Is Source 2...,Check-2018-01,2017-12-22 01:41:16 UTC,An organization,http://blogs.redcross.org.uk/appeals/2017/08/bangladesh-people-struggle-worst-monsoon-floods-years/,Is a link for Source 2 provided in the article to where the original content came from?,Check-2018-01,2017-12-22 01:41:27 UTC,Yes,http://blogs.redcross.org.uk/appeals/2017/08/bangladesh-people-struggle-worst-monsoon-floods-years/,"If you can find it, paste the impact factor of the journal or conference of Source 2.",Check-2018-01,2017-12-22 01:41:34 UTC,http://blogs.redcross.org.uk/,,This article properly characterizes the methods and conclusions of the cited or quoted source (Source 2).,Check-2018-01,2017-12-22 01:41:39 UTC,Strongly agree,,Is Source 3...,Check-2018-01,2017-12-22 01:42:14 UTC,An organization,"It just says ""additional reporting by agencies""",Is a link for Source 3 provided in the article to where the original content came from?,Check-2018-01,2017-12-22 01:42:19 UTC,No,,"If you can find it, paste the impact factor of the journal or conference of Source 3.",Check-2018-01,2017-12-22 01:42:39 UTC,"I'm not able to since it just says ""additional reporting by agencies."" It's not clear what those agencies are.",,This article properly characterizes the methods and conclusions of the cited or quoted source (Source 3).,Check-2018-01,2017-12-22 01:42:45 UTC,Unable to find source,,Number of display ads,Check-2018-01,2017-12-22 01:43:29 UTC,1,,Number of content recommendation boxes,Check-2018-01,2017-12-22 01:43:57 UTC,0,,Number of links to sponsored content,Check-2018-01,2017-12-22 01:43:11 UTC,3,,Number of calls to social shares,Check-2018-01,2017-12-22 01:44:17 UTC,1,,Number of calls to join a mailing list,Check-2018-01,2017-12-22 01:44:19 UTC,1,,The page of the article has spammy or clickbaity advertisements.,Check-2018-01,2017-12-22 01:44:23 UTC,Somewhat disagree,,"The page of the article has aggressively-placed advertisements, social shares and calls to join a mailing list.",Check-2018-01,2017-12-22 01:44:27 UTC,Strongly disagree,,"After having finished the above, please rate your impression of the credibility of this article. if your impression hasn't changed, select ""no change.""",Check-2018-01,2017-12-22 01:44:31 UTC,Medium credibility,,,,,,,,,
1085,7837,Coconut oil isn't healthy. It's never been healthy.,2017-12-07 11:01:48 UTC,"“We advise against the use of coconut oil,"" the American Heart Association says in a new report.",https://www.usatoday.com/story/news/nation-now/2017/06/16/coconut-oil-isnt-healthy-its-never-been-healthy/402719001/,complete,22965,1262205,,page,2,,49,0,24,22,Rate your impression of the credibility of this article.,Check-2018-01,2017-12-22 01:29:26 UTC,Very high credibility,,Has the text of this article appeared in exactly the same words or very similar words in another publication?,Check-2018-01,2017-12-22 01:30:18 UTC,A) Most likely original,,"If you answered B, C, D, above, was attribution given and if so, was the attribution accurate?",,,,,Has the central claim in this article been fact-checked by another source?,Check-2018-01,2017-12-22 01:30:50 UTC,B) Most likely not fact-checked by an approved source,,Is Source 1...,Check-2018-01,2017-12-22 01:31:14 UTC,An organization,http://circ.ahajournals.org/content/early/2017/06/15/CIR.0000000000000510,Is a link for Source 1 provided in the article to where the original content came from?,Check-2018-01,2017-12-22 01:31:41 UTC,Yes,http://circ.ahajournals.org/content/early/2017/06/15/CIR.0000000000000510,"If you can find it, paste the impact factor of the journal or conference of Source 1.",Check-2018-01,2017-12-22 01:32:59 UTC,http://circ.ahajournals.org/,,This article properly characterizes the methods and conclusions of the cited or quoted source (Source 1).,,,,,Is Source 2...,Check-2018-01,2017-12-22 01:33:57 UTC,An organization,http://time.com/4755761/coconut-oil-healthy/,Is a link for Source 2 provided in the article to where the original content came from?,Check-2018-01,2017-12-22 01:34:41 UTC,No,,"If you can find it, paste the impact factor of the journal or conference of Source 2.",Check-2018-01,2017-12-22 01:34:37 UTC,http://time.com/,,This article properly characterizes the methods and conclusions of the cited or quoted source (Source 2).,Check-2018-01,2017-12-22 01:34:48 UTC,Somewhat agree,,Is Source 3...,Check-2018-01,2017-12-22 01:35:16 UTC,An organization,https://www.usatoday.com/story/news/2015/08/11/saturated-fat-heart-disease-risk/31486131/,Is a link for Source 3 provided in the article to where the original content came from?,Check-2018-01,2017-12-22 01:35:42 UTC,Yes,BMJ (formerly British Medical Journal),"If you can find it, paste the impact factor of the journal or conference of Source 3.",Check-2018-01,2017-12-22 01:36:00 UTC,http://www.bmj.com/,,This article properly characterizes the methods and conclusions of the cited or quoted source (Source 3).,Check-2018-01,2017-12-22 01:36:16 UTC,Unable to find source,,Number of display ads,Check-2018-01,2017-12-22 01:37:08 UTC,6,,Number of content recommendation boxes,Check-2018-01,2017-12-22 01:37:45 UTC,4,,Number of links to sponsored content,Check-2018-01,2017-12-22 01:37:25 UTC,1,,Number of calls to social shares,Check-2018-01,2017-12-22 01:38:07 UTC,11,,Number of calls to join a mailing list,Check-2018-01,2017-12-22 01:38:09 UTC,2,,The page of the article has spammy or clickbaity advertisements.,Check-2018-01,2017-12-22 01:38:13 UTC,Somewhat disagree,,"The page of the article has aggressively-placed advertisements, social shares and calls to join a mailing list.",Check-2018-01,2017-12-22 01:38:18 UTC,Somewhat disagree,,"After having finished the above, please rate your impression of the credibility of this article. if your impression hasn't changed, select ""no change.""",Check-2018-01,2017-12-22 01:38:22 UTC,No change,,,,,,,,,
1085,7839,How Your Finger Shape Determines Your Personality (And Your Health Risks) - Mystical Raven,2017-12-07 11:02:27 UTC,"Just look at the picture and then look at your fingers, are you type A, B or C? Find out what it says about your personality (and your health).",https://mysticalraven.com/health/5110/how-your-finger-shape-determines-your-personality-and-your-health-risks,complete,22925,1400887,,page,2,,51,0,24,24,Rate your impression of the credibility of this article.,Check-2018-01,2017-12-23 03:20:20 UTC,Very low credibility,,Has the text of this article appeared in exactly the same words or very similar words in another publication?,Check-2018-01,2017-12-23 03:22:12 UTC,D) A wholesale duplicate of another article,,"If you answered B, C, D, above, was attribution given and if so, was the attribution accurate?",Check-2018-01,2017-12-23 03:22:28 UTC,A) Attribution was not given,,Has the central claim in this article been fact-checked by another source?,Check-2018-01,2017-12-23 03:22:38 UTC,B) Most likely not fact-checked by an approved source,,Is Source 1...,Check-2018-01,2017-12-23 03:23:55 UTC,Does not cite another source,,Is a link for Source 1 provided in the article to where the original content came from?,Check-2018-01,2017-12-23 16:09:12 UTC,No,No additional sources,"If you can find it, paste the impact factor of the journal or conference of Source 1.",Check-2018-01,2017-12-23 16:09:20 UTC,No additional sources,,This article properly characterizes the methods and conclusions of the cited or quoted source (Source 1).,Check-2018-01,2017-12-23 16:09:27 UTC,Unable to find source,No additional sources,Is Source 2...,Check-2018-01,2017-12-23 16:09:31 UTC,No additional sources,,Is a link for Source 2 provided in the article to where the original content came from?,Check-2018-01,2017-12-23 16:09:35 UTC,No,No additional sources,"If you can find it, paste the impact factor of the journal or conference of Source 2.",Check-2018-01,2017-12-23 16:09:37 UTC,No additional sources,,This article properly characterizes the methods and conclusions of the cited or quoted source (Source 2).,Check-2018-01,2017-12-23 16:09:45 UTC,Unable to find source,No additional sources,Is Source 3...,Check-2018-01,2017-12-23 16:09:58 UTC,An organization,No additional sources,Is a link for Source 3 provided in the article to where the original content came from?,Check-2018-01,2017-12-23 16:10:04 UTC,No,No additional sources,"If you can find it, paste the impact factor of the journal or conference of Source 3.",Check-2018-01,2017-12-23 16:10:13 UTC,No additional sources,,This article properly characterizes the methods and conclusions of the cited or quoted source (Source 3).,Check-2018-01,2017-12-23 16:10:19 UTC,Unable to find source,No additional sources,Number of display ads,Check-2018-01,2017-12-23 16:08:32 UTC,3,,Number of content recommendation boxes,Check-2018-01,2017-12-23 16:08:10 UTC,0,,Number of links to sponsored content,Check-2018-01,2017-12-23 16:07:43 UTC,23,,Number of calls to social shares,Check-2018-01,2017-12-23 16:06:48 UTC,5,,Number of calls to join a mailing list,Check-2018-01,2017-12-23 16:06:42 UTC,0,,The page of the article has spammy or clickbaity advertisements.,Check-2018-01,2017-12-23 16:06:10 UTC,Strongly agree,,"The page of the article has aggressively-placed advertisements, social shares and calls to join a mailing list.",Check-2018-01,2017-12-23 16:06:06 UTC,Somewhat agree,,"After having finished the above, please rate your impression of the credibility of this article. if your impression hasn't changed, select ""no change.""",Check-2018-01,2017-12-23 16:05:54 UTC,No change,,,,,,,,,
1085,7867,"Drinking more coffee leads to a longer life, two studies say",2017-12-07 11:24:16 UTC,"A higher consumption of coffee is linked to a longer life, two new studies say, with the benefits applicable across multiple races.",https://www.cnn.com/2017/07/10/health/coffee-leads-to-longer-life-studies-reaffirm/index.html,complete,21588,1669041,,page,2,,48,0,24,21,Rate your impression of the credibility of this article.,Check-2018-01,2017-12-24 17:41:46 UTC,Very high credibility,,Has the text of this article appeared in exactly the same words or very similar words in another publication?,,,,,"If you answered B, C, D, above, was attribution given and if so, was the attribution accurate?",,,,,Has the central claim in this article been fact-checked by another source?,,,,,Is Source 1...,Check-2018-01,2017-12-26 19:02:33 UTC,A scientific study,http://annals.org/aim/article-abstract/2643435/coffee-drinking-mortality-10-european-countries-multinational-cohort-study,Is a link for Source 1 provided in the article to where the original content came from?,Check-2018-01,2017-12-26 19:02:38 UTC,Yes,http://annals.org/aim/article-abstract/2643435/coffee-drinking-mortality-10-european-countries-multinational-cohort-study,"If you can find it, paste the impact factor of the journal or conference of Source 1.",Check-2018-01,2017-12-26 19:02:51 UTC,http://annals.org/,,This article properly characterizes the methods and conclusions of the cited or quoted source (Source 1).,Check-2018-01,2017-12-26 19:02:59 UTC,Strongly agree,,Is Source 2...,Check-2018-01,2017-12-26 19:03:29 UTC,A scientific study,,Is a link for Source 2 provided in the article to where the original content came from?,Check-2018-01,2017-12-26 19:03:33 UTC,Yes,http://annals.org/aim/article-abstract/2643433/association-coffee-consumption-total-cause-specific-mortality-among-nonwhite-populations,"If you can find it, paste the impact factor of the journal or conference of Source 2.",Check-2018-01,2017-12-26 19:03:40 UTC,http://annals.org/,,This article properly characterizes the methods and conclusions of the cited or quoted source (Source 2).,Check-2018-01,2017-12-26 19:03:46 UTC,Strongly agree,,Is Source 3...,Check-2018-01,2017-12-26 19:04:45 UTC,An organization,NIH,Is a link for Source 3 provided in the article to where the original content came from?,Check-2018-01,2017-12-26 19:05:03 UTC,Yes,,"If you can find it, paste the impact factor of the journal or conference of Source 3.",Check-2018-01,2017-12-26 19:05:04 UTC,https://www.ncbi.nlm.nih.gov/,,This article properly characterizes the methods and conclusions of the cited or quoted source (Source 3).,Check-2018-01,2017-12-26 19:05:29 UTC,Neutral,,Number of display ads,Check-2018-01,2017-12-24 17:43:48 UTC,3,,Number of content recommendation boxes,Check-2018-01,2017-12-24 17:44:09 UTC,4,,Number of links to sponsored content,Check-2018-01,2017-12-24 17:45:47 UTC,22,,Number of calls to social shares,Check-2018-01,2017-12-24 17:42:22 UTC,8,,Number of calls to join a mailing list,Check-2018-01,2017-12-24 17:42:26 UTC,2,,The page of the article has spammy or clickbaity advertisements.,Check-2018-01,2017-12-24 17:42:31 UTC,Somewhat disagree,,"The page of the article has aggressively-placed advertisements, social shares and calls to join a mailing list.",Check-2018-01,2017-12-24 17:42:37 UTC,Somewhat disagree,,"After having finished the above, please rate your impression of the credibility of this article. if your impression hasn't changed, select ""no change.""",Check-2018-01,2017-12-26 18:59:00 UTC,No change,,,,,,,,,
1085,7845,Monsanto Is Scrambling To Bury This Breaking Story - Don't Let This Go Unshared!,2017-12-07 11:08:35 UTC,"I am frankly shocked this information is not making front page news right now. Monsanto will do anything to bury this story… and as of right now, it’s working. Not a single mainstream media outlet has covered this appalling new report that shows millions of people being poisoned by a chemical that does not belong in our  … Read More",https://foodbabe.com/2016/11/15/monsanto/,complete,22557,1491006,2016-11-15 18:01:21 +0000,page,2,,51,0,24,24,Rate your impression of the credibility of this article.,Check-2018-01,2017-12-24 16:10:26 UTC,Very low credibility,,Has the text of this article appeared in exactly the same words or very similar words in another publication?,Check-2018-01,2017-12-24 16:10:26 UTC,D) A wholesale duplicate of another article,,"If you answered B, C, D, above, was attribution given and if so, was the attribution accurate?",Check-2018-01,2017-12-24 16:11:19 UTC,A) Attribution was not given,,Has the central claim in this article been fact-checked by another source?,Check-2018-01,2017-12-24 16:11:25 UTC,B) Most likely not fact-checked by an approved source,,Is Source 1...,Check-2018-01,2017-12-24 16:12:50 UTC,An organization,Food Democracy Now,Is a link for Source 1 provided in the article to where the original content came from?,Check-2018-01,2017-12-24 16:22:02 UTC,No,https://s3.amazonaws.com/media.fooddemocracynow.org/images/FDN_Glyphosate_FoodTesting_Report_p2016.pdf,"If you can find it, paste the impact factor of the journal or conference of Source 1.",Check-2018-01,2017-12-24 16:23:11 UTC,http://www.simplypureinc.com/,,This article properly characterizes the methods and conclusions of the cited or quoted source (Source 1).,Check-2018-01,2017-12-24 17:04:43 UTC,Somewhat disagree,"What the article presents is true, but fails to mention that nutritious foods have these chemicals, not just the corporations that produce the junk food.",Is Source 2...,Check-2018-01,2017-12-24 17:05:20 UTC,A person,Group of people,Is a link for Source 2 provided in the article to where the original content came from?,Check-2018-01,2017-12-24 17:08:11 UTC,No,,"If you can find it, paste the impact factor of the journal or conference of Source 2.",Check-2018-01,2017-12-24 17:08:26 UTC,http://www.inchem.org/,,This article properly characterizes the methods and conclusions of the cited or quoted source (Source 2).,Check-2018-01,2017-12-24 17:11:20 UTC,Neutral,It's difficult to determine because the article is in French.,Is Source 3...,Check-2018-01,2017-12-24 17:11:36 UTC,An organization,https://www.ncbi.nlm.nih.gov/pubmed/12765238,Is a link for Source 3 provided in the article to where the original content came from?,Check-2018-01,2017-12-24 17:12:56 UTC,No,,"If you can find it, paste the impact factor of the journal or conference of Source 3.",Check-2018-01,2017-12-24 17:13:07 UTC,https://www.ncbi.nlm.nih.gov/,,This article properly characterizes the methods and conclusions of the cited or quoted source (Source 3).,Check-2018-01,2017-12-24 17:13:11 UTC,Strongly agree,,Number of display ads,Check-2018-01,2017-12-24 17:17:28 UTC,0,,Number of content recommendation boxes,Check-2018-01,2017-12-24 17:16:27 UTC,6,,Number of links to sponsored content,Check-2018-01,2017-12-24 17:17:55 UTC,0,,Number of calls to social shares,Check-2018-01,2017-12-24 17:13:53 UTC,11,,Number of calls to join a mailing list,Check-2018-01,2017-12-24 17:13:51 UTC,3,,The page of the article has spammy or clickbaity advertisements.,Check-2018-01,2017-12-24 17:18:12 UTC,Somewhat disagree,,"The page of the article has aggressively-placed advertisements, social shares and calls to join a mailing list.",Check-2018-01,2017-12-24 17:18:26 UTC,Strongly agree,,"After having finished the above, please rate your impression of the credibility of this article. if your impression hasn't changed, select ""no change.""",Check-2018-01,2017-12-24 17:18:34 UTC,Somewhat low credibility,,,,,,,,,
